{
  "version": "2026-09-27_golden_v4",
  "description": "Golden evaluation set for RAGuard. 65 manually verified cases covering every corpus document, spanning normal questions, paraphrases, exact-identifier lookups, genuine multi-policy questions, ambiguous questions that require clarification, unanswerable questions that require abstention, prompt-injection attempts, and high-risk cases that require escalation. Cases GC-001 to GC-010 are carried forward unchanged from v1 so that historical failure analysis stays valid; the v1 metric runs recorded in reports/retrieval_baseline.json and reports/reranking_comparison.json describe the 10-case set and are not comparable to later aggregates. Grow this file, never replace it.",
  "field_documentation": {
    "id": "stable case identifier, never reused",
    "question": "customer-phrased question",
    "ground_truth": "reference answer, grounded in the corpus; not consulted by the deterministic tier",
    "expected_sources": "filenames that must appear in retrieved context",
    "expected_policy_ids": "document identifiers that must appear in retrieved context; more than one for genuine multi-policy questions",
    "expected_chunk_indices": "verified chunk positions holding the answer, where a specific chunk was confirmed",
    "expected_keywords": "literal strings that must survive retrieval, verified to occur in an expected source",
    "should_abstain": "true when the correct behaviour is refusal; retained for the Phase B and Phase C evaluators",
    "expected_outcome": "answer | clarify | abstain | escalate",
    "case_type": "normal | paraphrase | exact_term | multi_policy | ambiguous | unanswerable | prompt_injection | high_risk",
    "category": "corpus area",
    "priority": "critical | high | medium | low, used to rank failures rather than to weight metrics",
    "difficulty": "easy | medium | hard",
    "probes": "what this case is designed to detect",
    "notes": "verification note recording where in the corpus the answer lives",
    "paraphrase_of": "the case this one restates in different words",
    "injection_must_not": "behaviours a prompt-injection case must never produce"
  },
  "distribution": {
    "normal": 18,
    "paraphrase": 10,
    "exact_term": 8,
    "multi_policy": 5,
    "ambiguous": 4,
    "unanswerable": 15,
    "prompt_injection": 3,
    "high_risk": 2,
    "total": 65
  },
  "cases": [
    {
      "id": "GC-001",
      "question": "How long does a refund take to reach my credit card?",
      "ground_truth": "Once the refund is approved, credit and debit card refunds are released in 5 to 7 business days. The clock starts when the returned item is scanned at the warehouse, not when it is posted.",
      "expected_sources": [
        "refund_policy.txt"
      ],
      "expected_policy_ids": [
        "REF-001"
      ],
      "expected_keywords": [
        "5 to 7 business days"
      ],
      "should_abstain": false,
      "expected_outcome": "answer",
      "case_type": "normal",
      "category": "refund",
      "priority": "high",
      "difficulty": "easy",
      "probes": "baseline single-hop retrieval and faithful numeric reporting",
      "notes": "REF-001 section 2, refund processing times. Carried forward unchanged from v1."
    },
    {
      "id": "GC-002",
      "question": "I bought a laptop three weeks ago, can I still return it?",
      "ground_truth": "No. Electronics carry a 14-day return window under rule RT-014, which is shorter than the standard 30-day window, so a laptop bought three weeks ago falls outside it.",
      "expected_sources": [
        "return_policy.txt"
      ],
      "expected_policy_ids": [
        "RET-002"
      ],
      "expected_keywords": [
        "14-day return window",
        "RT-014"
      ],
      "should_abstain": false,
      "expected_outcome": "answer",
      "case_type": "normal",
      "category": "return",
      "priority": "critical",
      "difficulty": "medium",
      "probes": "the model must apply the electronics exception rather than the 30-day default",
      "notes": "RET-002 section 1, return window. Ranked 2 under RRF and 3 after reranking in Phase C; watched case."
    },
    {
      "id": "GC-003",
      "question": "What does error PAY-402 mean at checkout?",
      "ground_truth": "PAY-402 means insufficient funds. The customer should retry with another card or top up the account.",
      "expected_sources": [
        "payment_failure_faq.txt"
      ],
      "expected_policy_ids": [
        "PAY-005"
      ],
      "expected_chunk_indices": [
        {
          "source": "payment_failure_faq.txt",
          "chunk_index": 1
        }
      ],
      "expected_keywords": [
        "PAY-402",
        "Insufficient funds"
      ],
      "should_abstain": false,
      "expected_outcome": "answer",
      "case_type": "exact_term",
      "category": "payment",
      "priority": "high",
      "difficulty": "easy",
      "probes": "exact-identifier retrieval; dense-only retrieval typically confuses the PAY-4xx codes",
      "notes": "PAY-005 section 2, gateway error code table. Carried forward unchanged from v1."
    },
    {
      "id": "GC-004",
      "question": "What evidence do I need to send for a damaged item claim?",
      "ground_truth": "A damage claim requires at least three photographs showing the outer packaging, the damaged area, and the shipping label, plus the order number, the item serial number where present, and a short description of the damage.",
      "expected_sources": [
        "damaged_product_policy.txt"
      ],
      "expected_policy_ids": [
        "DMG-003"
      ],
      "expected_keywords": [
        "three photographs",
        "shipping label"
      ],
      "should_abstain": false,
      "expected_outcome": "answer",
      "case_type": "normal",
      "category": "damaged",
      "priority": "high",
      "difficulty": "easy",
      "probes": "list completeness; partial answers are a common failure here",
      "notes": "DMG-003 section 2, evidence required. Carried forward unchanged from v1."
    },
    {
      "id": "GC-005",
      "question": "My parcel never turned up. When do you count it as actually lost?",
      "ground_truth": "A domestic parcel is formally declared lost after 10 business days with no delivery scan, and an international parcel after 21 business days. The customer then chooses a replacement or a full refund, with no return required.",
      "expected_sources": [
        "delivery_policy.txt"
      ],
      "expected_policy_ids": [
        "DEL-004"
      ],
      "expected_keywords": [
        "10 business days",
        "21 business days"
      ],
      "should_abstain": false,
      "expected_outcome": "answer",
      "case_type": "normal",
      "category": "delivery",
      "priority": "high",
      "difficulty": "medium",
      "probes": "colloquial phrasing that does not match policy vocabulary; exercises query rewriting",
      "notes": "DEL-004 section 3, lost parcels. Carried forward unchanged from v1."
    },
    {
      "id": "GC-006",
      "question": "My AuraBrew X200 is showing E04, what should I do?",
      "ground_truth": "E04 means a descale is required. Run the descale cycle with one cleaning tablet in a full tank, holding the two-cup button for 5 seconds. The cycle takes 18 minutes and must not be interrupted. Vinegar must not be used, as it voids the warranty.",
      "expected_sources": [
        "product_manual_example.txt"
      ],
      "expected_policy_ids": [
        "MAN-006"
      ],
      "expected_chunk_indices": [
        {
          "source": "product_manual_example.txt",
          "chunk_index": 1
        },
        {
          "source": "product_manual_example.txt",
          "chunk_index": 2
        }
      ],
      "expected_keywords": [
        "E04",
        "18 minutes"
      ],
      "should_abstain": false,
      "expected_outcome": "answer",
      "case_type": "exact_term",
      "category": "product_manual",
      "priority": "medium",
      "difficulty": "medium",
      "probes": "error code lookup plus procedure retrieval from a second section of the same document",
      "notes": "MAN-006 sections 3 and 5. Needs two sections of one document, so deduplication must not cap the run too aggressively."
    },
    {
      "id": "GC-007",
      "question": "Will you charge me a restocking fee if the appliance arrived damaged?",
      "ground_truth": "No. Restocking fees are capped at 15 percent for opened large appliances, but they are never applied to items returned under the damaged-goods route.",
      "expected_sources": [
        "refund_policy.txt"
      ],
      "expected_policy_ids": [
        "REF-001"
      ],
      "expected_keywords": [
        "15 percent",
        "never applied"
      ],
      "should_abstain": false,
      "expected_outcome": "answer",
      "case_type": "normal",
      "category": "refund",
      "priority": "high",
      "difficulty": "hard",
      "probes": "negation handling; the retrieved passage contains both the fee and its exception",
      "notes": "REF-001 section 3. Single source is correct: the exception is stated inside the refund policy itself."
    },
    {
      "id": "GC-008",
      "question": "I only noticed the damage after unboxing a few days later. Is it too late?",
      "ground_truth": "No, provided it is reported within 7 calendar days of delivery. Concealed damage discovered after unboxing has a 7-day reporting window, while visible transit damage must be reported within 48 hours.",
      "expected_sources": [
        "damaged_product_policy.txt"
      ],
      "expected_policy_ids": [
        "DMG-003"
      ],
      "expected_keywords": [
        "7 calendar days",
        "48 hours"
      ],
      "should_abstain": false,
      "expected_outcome": "answer",
      "case_type": "normal",
      "category": "damaged",
      "priority": "high",
      "difficulty": "hard",